"ticker","title","summary","published","description","link","language","subject","sector","published_est","market","hour_of_day","begin_price","end_price","index_begin_price","index_end_price","return","index_return","alpha"
DYAI,Dyadic Announces Second Quarter 2023 Financial Results and Highlights Recent Company Progress,"JUPITER, Fla., Aug.  09, 2023  (GLOBE NEWSWIRE) -- Dyadic International, Inc. (“Dyadic”, “we”, “us”, “our”, or the “Company”) (NASDAQ: DYAI), a global biotechnology company focused on building innovative microbial platforms to develop and produce biopharmaceuticals and alternative proteins for human and animal health, today announced its financial results for the second quarter of 2023, and highlighted recent company developments.",2023-08-09 23:00:00.000 +0300,"JUPITER, Fla., Aug.  09, 2023  (GLOBE NEWSWIRE) -- Dyadic International, Inc. (“Dyadic”, “we”, “us”, “our”, or the “Company”) (NASDAQ: DYAI), a global biotechnology company focused on building innovative microbial platforms to develop and produce biopharmaceuticals and alternative proteins for human and animal health, today announced its financial results for the second quarter of 2023, and highlighted recent company developments.",https://www.globenewswire.com/news-release/2023/08/09/2722067/0/en/Dyadic-Announces-Second-Quarter-2023-Financial-Results-and-Highlights-Recent-Company-Progress.html,,Earnings Releases and Operating Results,biotech,2023-08-09 18:00:00.000 +0300,market_open,15,1.7799999713897705,1.7999999523162842,449.0299987792969,445.75,0.011235944521335181,-0.00730463173554921,0.018540576256884392
FBIO,Helocyte Announces $3.22 Million Grant from the National Cancer Institute for Triplex Phase 2 Clinical Trial Program,Multicenter randomized placebo-controlled trials will evaluate the ability of the cytomegalovirus (“CMV”) vaccine to enhance protective virus-specific immunity in stem cell donors to reduce the risk of CMV events in high-risk transplant recipients,2023-06-15 15:00:00.000 +0300,Multicenter randomized placebo-controlled trials will evaluate the ability of the cytomegalovirus (“CMV”) vaccine to enhance protective virus-specific immunity in stem cell donors to reduce the risk of CMV events in high-risk transplant recipients,https://www.globenewswire.com/news-release/2023/06/15/2688861/28889/en/Helocyte-Announces-3-22-Million-Grant-from-the-National-Cancer-Institute-for-Triplex-Phase-2-Clinical-Trial-Program.html,,Clinical Study,biotech,2023-06-15 10:00:00.000 +0300,pre_market,7,9.300000190734863,9.449999809265137,437.17999267578125,436.3299865722656,0.016128990909022856,-0.0019442932379250056,0.018073284146947862
CHRS,Coherus Applauds Congressional Designation of September 30th as Rare Cancer Day,- Bipartisan resolution highlights the challenges patients with rare cancers face and raises awareness and supports efforts to improve early diagnosis and development of effective treatments -,2023-10-02 16:00:00.000 +0300,- Bipartisan resolution highlights the challenges patients with rare cancers face and raises awareness and supports efforts to improve early diagnosis and development of effective treatments -,https://www.globenewswire.com/news-release/2023/10/02/2752800/33333/en/Coherus-Applauds-Congressional-Designation-of-September-30th-as-Rare-Cancer-Day.html,,Health,biotech,2023-10-02 11:00:00.000 +0300,pre_market,8,3.740000009536743,3.799999952316284,427.4800109863281,426.6199951171875,0.016042765408167188,-0.0020118270960934603,0.01805459250426065
CHRS,"Coherus BioSciences to Report Second Quarter 2023 Financial Results on August 02, 2023","REDWOOD CITY, Calif., July  26, 2023  (GLOBE NEWSWIRE) -- Coherus BioSciences, Inc. (“Coherus”, Nasdaq: CHRS) today announced its second quarter 2023 financial results will be released after market close on Wednesday, August 02, 2023. Starting at 5:00 pm ET on August 02, 2023, Coherus’ management team will host a conference call and webcast to discuss financial results and provide a general business update.",2023-07-26 23:05:00.000 +0300,"REDWOOD CITY, Calif., July  26, 2023  (GLOBE NEWSWIRE) -- Coherus BioSciences, Inc. (“Coherus”, Nasdaq: CHRS) today announced its second quarter 2023 financial results will be released after market close on Wednesday, August 02, 2023. Starting at 5:00 pm ET on August 02, 2023, Coherus’ management team will host a conference call and webcast to discuss financial results and provide a general business update.",https://www.globenewswire.com/news-release/2023/07/26/2711653/33333/en/Coherus-BioSciences-to-Report-Second-Quarter-2023-Financial-Results-on-August-02-2023.html,,Conference Calls/ Webcasts,biotech,2023-07-26 18:05:00.000 +0300,market_open,15,4.440000057220459,4.53000020980835,454.4700012207031,455.510009765625,0.020270304375678942,0.002288398666861222,0.01798190570881772
SCPH,scPharmaceuticals Provides FUROSCIX® (furosemide injection) Commercial Update,"Commercial launch planned for February 20, 2023 Commercial launch planned for February 20, 2023",2023-01-30 15:00:00.000 +0200,"Commercial launch planned for February 20, 2023 Commercial launch planned for February 20, 2023",https://www.globenewswire.com/news-release/2023/01/30/2597485/0/en/scPharmaceuticals-Provides-FUROSCIX-furosemide-injection-Commercial-Update.html,,Product / Services Announcement,biotech,2023-01-30 10:00:00.000 +0200,pre_market,8,5.690000057220459,5.75,405.67999267578125,402.79998779296875,0.010544805303367736,-0.007099203645258875,0.01764400894862661
SCLX,"Scilex Holding Company Generates Record Monthly Revenue In August 2023 And Provides Certain Preliminary Unaudited Financial Results For Gross And Net Sales For The One Month Ended August 2023, And Year-To-Date As Of August 31 2023, Based On Currently Available Information","PALO ALTO, Calif., Sept.  11, 2023  (GLOBE NEWSWIRE) -- Scilex Holding Company (Nasdaq: SCLX, “Scilex”), a majority-owned subsidiary of Sorrento Therapeutics, Inc. (OTC: SRNEQ), an innovative revenue-generating company focused on acquiring, developing and commercializing non-opioid pain management products for the treatment of acute and chronic pain, announces record revenue for the month of August 2023 and is providing certain preliminary unaudited financial results for the month ended August 31, 2023, and year-to-date as of August 31, 2023, based on currently available information.",2023-09-11 16:00:00.000 +0300,"PALO ALTO, Calif., Sept.  11, 2023  (GLOBE NEWSWIRE) -- Scilex Holding Company (Nasdaq: SCLX, “Scilex”), a majority-owned subsidiary of Sorrento Therapeutics, Inc. (OTC: SRNEQ), an innovative revenue-generating company focused on acquiring, developing and commercializing non-opioid pain management products for the treatment of acute and chronic pain, announces record revenue for the month of August 2023 and is providing certain preliminary unaudited financial results for the month ended August 31, 2023, and year-to-date as of August 31, 2023, based on currently available information.",https://www.globenewswire.com/news-release/2023/09/11/2740873/0/en/Scilex-Holding-Company-Generates-Record-Monthly-Revenue-In-August-2023-And-Provides-Certain-Preliminary-Unaudited-Financial-Results-For-Gross-And-Net-Sales-For-The-One-Month-Ended-.html,,Pre-Release Comments,biotech,2023-09-11 11:00:00.000 +0300,pre_market,8,2.5399999618530273,2.5999999046325684,445.5199890136719,448.239990234375,0.023622025071121953,0.006105228245145371,0.017516796825976583
QGEN,FBI approves QIAGEN’s NGS-based ForenSeq MainstAY workflow for the U.S. National DNA Index System (NDIS),NDIS approval provides access to federal government funding for accredited public crime laboratories in the U.S. to implement next-generation sequencing (NGS) for routine casework // NGS-based ForenSeq MainstAY workflow from QIAGEN provides a cost-effective alternative to traditional capillary electrophoresis // Combination of ForenSeq MainstAY and ForenSeq Kintelligence from QIAGEN enables end-to-end workflow for forensic investigative genetic genealogy (FIGG) NDIS approval provides access to federal government funding for accredited public crime laboratories in the U.S. to implement next-generation sequencing (NGS) for routine casework // NGS-based ForenSeq MainstAY workflow from QIAGEN provides a cost-effective alternative to traditional capillary electrophoresis // Combination of ForenSeq MainstAY and ForenSeq Kintelligence from QIAGEN enables end-to-end workflow for forensic investigative genetic genealogy (FIGG),2023-06-20 23:05:00.000 +0300,NDIS approval provides access to federal government funding for accredited public crime laboratories in the U.S. to implement next-generation sequencing (NGS) for routine casework // NGS-based ForenSeq MainstAY workflow from QIAGEN provides a cost-effective alternative to traditional capillary electrophoresis // Combination of ForenSeq MainstAY and ForenSeq Kintelligence from QIAGEN enables end-to-end workflow for forensic investigative genetic genealogy (FIGG) NDIS approval provides access to federal government funding for accredited public crime laboratories in the U.S. to implement next-generation sequencing (NGS) for routine casework // NGS-based ForenSeq MainstAY workflow from QIAGEN provides a cost-effective alternative to traditional capillary electrophoresis // Combination of ForenSeq MainstAY and ForenSeq Kintelligence from QIAGEN enables end-to-end workflow for forensic investigative genetic genealogy (FIGG),https://www.globenewswire.com/news-release/2023/06/20/2691593/8690/en/FBI-approves-QIAGEN-s-NGS-based-ForenSeq-MainstAY-workflow-for-the-U-S-National-DNA-Index-System-NDIS.html,,Company Announcement,biotech,2023-06-20 18:05:00.000 +0300,market_open,15,45.310001373291016,46.06999969482422,437.45001220703125,437.17999267578125,0.016773301666267462,-0.0006172580265519,0.017390559692819323
ARQT,FDA Approves Arcutis’ ZORYVE® (roflumilast) Cream 0.3% for Treatment of Psoriasis in Children Ages 6 to 11,Arcutis today announced the FDA has approved an sNDA to expand the indication of ZORYVE (roflumilast) cream 0.3%.,2023-10-06 15:00:00.000 +0300,Arcutis today announced the FDA has approved an sNDA to expand the indication of ZORYVE (roflumilast) cream 0.3%.,https://www.globenewswire.com/news-release/2023/10/06/2756044/0/en/FDA-Approves-Arcutis-ZORYVE-roflumilast-Cream-0-3-for-Treatment-of-Psoriasis-in-Children-Ages-6-to-11.html,,Product / Services Announcement,biotech,2023-10-06 10:00:00.000 +0300,pre_market,7,4.429999828338623,4.480000019073486,424.5,421.9700012207031,0.011286725208207239,-0.005959950010122203,0.01724667521832944
OCUP,Ocuphire to Present at American Society of Retina Specialists Annual Meeting and OIS Retina Innovation Summit,ASRS presentations will feature data from ZETA-1 Phase 2 trial evaluating APX3330 in diabetic retinopathy,2023-07-26 15:00:00.000 +0300,ASRS presentations will feature data from ZETA-1 Phase 2 trial evaluating APX3330 in diabetic retinopathy,https://www.globenewswire.com/news-release/2023/07/26/2711269/0/en/Ocuphire-to-Present-at-American-Society-of-Retina-Specialists-Annual-Meeting-and-OIS-Retina-Innovation-Summit.html,,Health,biotech,2023-07-26 10:00:00.000 +0300,pre_market,7,3.9800000190734863,4.039999961853027,455.44000244140625,454.4700012207031,0.015075362435176206,-0.0021298112056547308,0.017205173640830938
SCLX,"Scilex Holding Company to Present Data on ELYXYB™ (celecoxib oral solution) at the 65th Annual Scientific Meeting of the American Headache Society, in Austin, TX.","PALO ALTO, Calif., June  16, 2023  (GLOBE NEWSWIRE) -- Scilex Holding Company (Nasdaq: SCLX, “Scilex”), a majority-owned subsidiary of Sorrento Therapeutics, Inc. (OTC: SRNEQ), an innovative revenue-generating company focused on acquiring, developing and commercializing non-opioid pain management products for the treatment of acute and chronic pain, announced that it will be presenting data on ELYXYB™ (celecoxib oral solution) for acute treatment of migraine with or without aura in adults at the 65th Annual Scientific Meeting of American Headache Society (AHS) to be held on June 14-18, 2023 in Austin, Texas.",2023-06-16 16:00:00.000 +0300,"PALO ALTO, Calif., June  16, 2023  (GLOBE NEWSWIRE) -- Scilex Holding Company (Nasdaq: SCLX, “Scilex”), a majority-owned subsidiary of Sorrento Therapeutics, Inc. (OTC: SRNEQ), an innovative revenue-generating company focused on acquiring, developing and commercializing non-opioid pain management products for the treatment of acute and chronic pain, announced that it will be presenting data on ELYXYB™ (celecoxib oral solution) for acute treatment of migraine with or without aura in adults at the 65th Annual Scientific Meeting of American Headache Society (AHS) to be held on June 14-18, 2023 in Austin, Texas.",https://www.globenewswire.com/news-release/2023/06/16/2689744/0/en/Scilex-Holding-Company-to-Present-Data-on-ELYXYB-celecoxib-oral-solution-at-the-65th-Annual-Scientific-Meeting-of-the-American-Headache-Society-in-Austin-TX.html,,Calendar of Events,biotech,2023-06-16 11:00:00.000 +0300,pre_market,8,7.78000020980835,7.920000076293945,442.6000061035156,443.0199890136719,0.017994840965312058,0.000948899467611,0.01704594149770106
DYAI,"Dyadic and bYoRNA Announce a Collaboration Targeting the Production of Abundant, Low-Cost mRNA From C1-Cells","JUPITER, Fla. and PARIS, Sept.  26, 2023  (GLOBE NEWSWIRE) -- Dyadic International, Inc. (“Dyadic”) (NASDAQ: DYAI) and bYoRNA SAS (""bYoRNA"") today announced that they entered into a development and commercialization agreement to work on disruptive bioproduction technologies that will help exploit the therapeutic potential of messenger RNA (""mRNA""). Dyadic is a global biotechnology company focused on building innovative microbial platforms to address the growing demand for global protein bioproduction and unmet clinical needs for effective, affordable, and accessible biopharmaceutical products and alternative proteins for human and animal health. bYoRNA is a French biotechnology company focused on producing affordable therapeutic mRNA, at scale, for human and animal health.",2023-09-26 15:30:00.000 +0300,"JUPITER, Fla. and PARIS, Sept.  26, 2023  (GLOBE NEWSWIRE) -- Dyadic International, Inc. (“Dyadic”) (NASDAQ: DYAI) and bYoRNA SAS (""bYoRNA"") today announced that they entered into a development and commercialization agreement to work on disruptive bioproduction technologies that will help exploit the therapeutic potential of messenger RNA (""mRNA""). Dyadic is a global biotechnology company focused on building innovative microbial platforms to address the growing demand for global protein bioproduction and unmet clinical needs for effective, affordable, and accessible biopharmaceutical products and alternative proteins for human and animal health. bYoRNA is a French biotechnology company focused on producing affordable therapeutic mRNA, at scale, for human and animal health.",https://www.globenewswire.com/news-release/2023/09/26/2749502/0/en/Dyadic-and-bYoRNA-Announce-a-Collaboration-Targeting-the-Production-of-Abundant-Low-Cost-mRNA-From-C1-Cells.html,,Partnerships,biotech,2023-09-26 10:30:00.000 +0300,pre_market,7,2.0799999237060547,2.0999999046325684,432.2300109863281,429.0899963378906,0.009615375798129148,-0.007264684470363678,0.016880060268492827
ARQT,Arcutis Launches First Television Ad for ZORYVE® (Roflumilast) Cream 0.3%,"WESTLAKE VILLAGE, Calif., Aug.  29, 2023  (GLOBE NEWSWIRE) --  Arcutis Biotherapeutics, Inc. (Nasdaq: ARQT), an early commercial-stage biopharmaceutical company focused on developing meaningful innovations in immuno-dermatology, today announced the launch of The Cream That Can, the first commercial direct-to-consumer ad for ZORYVE® (roflumilast) cream 0.3% for the treatment of plaque psoriasis, including intertriginous psoriasis in adults and adolescents. The Cream That Can campaign invites individuals with psoriasis to reimagine a steroid-free cream for their psoriasis.",2023-08-29 15:00:00.000 +0300,"WESTLAKE VILLAGE, Calif., Aug.  29, 2023  (GLOBE NEWSWIRE) --  Arcutis Biotherapeutics, Inc. (Nasdaq: ARQT), an early commercial-stage biopharmaceutical company focused on developing meaningful innovations in immuno-dermatology, today announced the launch of The Cream That Can, the first commercial direct-to-consumer ad for ZORYVE® (roflumilast) cream 0.3% for the treatment of plaque psoriasis, including intertriginous psoriasis in adults and adolescents. The Cream That Can campaign invites individuals with psoriasis to reimagine a steroid-free cream for their psoriasis.",https://www.globenewswire.com/news-release/2023/08/29/2733332/0/en/Arcutis-Launches-First-Television-Ad-for-ZORYVE-Roflumilast-Cream-0-3.html,,Product / Services Announcement,biotech,2023-08-29 10:00:00.000 +0300,pre_market,7,8.020000457763672,8.149999618530273,442.760009765625,442.6499938964844,0.0162093707414639,-0.0002484774295647,0.01645784817102865
ELOX,Eloxx Pharmaceuticals Highlights Recent Alport Syndrome Natural History Data Presented at 60th ERA Congress,"Data from RaDaR natural history study indicates that Alport syndrome patients with autosomal recessive COL4A4 mutations have severest disease, with a more rapid progression to kidney failure",2023-06-21 16:00:00.000 +0300,"Data from RaDaR natural history study indicates that Alport syndrome patients with autosomal recessive COL4A4 mutations have severest disease, with a more rapid progression to kidney failure",https://www.globenewswire.com/news-release/2023/06/21/2692112/0/en/Eloxx-Pharmaceuticals-Highlights-Recent-Alport-Syndrome-Natural-History-Data-Presented-at-60th-ERA-Congress.html,,Clinical Study,biotech,2023-06-21 11:00:00.000 +0300,pre_market,8,4.960000038146973,5.03000020980835,437.17999267578125,436.1600036621094,0.014112937726413529,-0.0023331100021960816,0.016446047728609612
JSPR,Jasper Therapeutics to Participate in the Oppenheimer 32nd Annual Healthcare Conference,"REDWOOD CITY, Calif., March  10, 2022  (GLOBE NEWSWIRE) -- Jasper Therapeutics, Inc. (NASDAQ: JSPR), a biotechnology company focused on hematopoietic cell transplant therapies, today announced that the Company is participating in the 32nd Annual Oppenheimer Healthcare investor conference, to be held virtually from March 15-17, 2022.",2022-03-10 15:00:00.000 +0200,"REDWOOD CITY, Calif., March  10, 2022  (GLOBE NEWSWIRE) -- Jasper Therapeutics, Inc. (NASDAQ: JSPR), a biotechnology company focused on hematopoietic cell transplant therapies, today announced that the Company is participating in the 32nd Annual Oppenheimer Healthcare investor conference, to be held virtually from March 15-17, 2022.",https://www.globenewswire.com/news-release/2022/03/10/2400877/0/en/Jasper-Therapeutics-to-Participate-in-the-Oppenheimer-32nd-Annual-Healthcare-Conference.html,,Calendar of Events,biotech,2022-03-10 10:00:00.000 +0200,pre_market,8,3.390000104904175,3.4000000953674316,427.4100036621094,422.5199890136719,0.0029498496028924183,-0.01144103929842344,0.01439088890131586
EYEN,"Eyenovia to Report Fourth Quarter and Full-Year 2022 Results on Thursday, March 30",Company to host an investor conference call and webcast at 4:30 pm ET Company to host an investor conference call and webcast at 4:30 pm ET,2023-03-23 14:00:00.000 +0200,Company to host an investor conference call and webcast at 4:30 pm ET Company to host an investor conference call and webcast at 4:30 pm ET,https://www.globenewswire.com/news-release/2023/03/23/2633055/0/en/Eyenovia-to-Report-Fourth-Quarter-and-Full-Year-2022-Results-on-Thursday-March-30.html,,Conference Calls/ Webcasts,biotech,2023-03-23 09:00:00.000 +0200,pre_market,7,2.7300000190734863,2.7899999618530273,392.1099853515625,395.0899963378906,0.02197800086459484,0.007599936491431791,0.01437806437316305
ORIC,ORIC Pharmaceuticals Announces Multiple Presentations at the 2023 American Association for Cancer Research (AACR) Annual Meeting,ORIC-944 preclinical poster presentation to highlight comprehensive biomarker strategy for ongoing Phase 1 trial in metastatic prostate cancer,2023-03-14 22:30:00.000 +0200,ORIC-944 preclinical poster presentation to highlight comprehensive biomarker strategy for ongoing Phase 1 trial in metastatic prostate cancer,https://www.globenewswire.com/news-release/2023/03/14/2627208/0/en/ORIC-Pharmaceuticals-Announces-Multiple-Presentations-at-the-2023-American-Association-for-Cancer-Research-AACR-Annual-Meeting.html,,Health,biotech,2023-03-14 17:30:00.000 +0200,market_open,15,4.570000171661377,4.650000095367432,390.5,391.7300109863281,0.017505453107449564,0.0031498360725432137,0.01435561703490635
VIR,Vir Biotechnology Provides Corporate Update and Reports First Quarter 2023 Financial Results,"– Multiple data readouts anticipated in 2023 from ongoing Phase 2 programsin hepatitis B and D, and influenza –",2023-05-04 23:05:00.000 +0300,"– Multiple data readouts anticipated in 2023 from ongoing Phase 2 programsin hepatitis B and D, and influenza –",https://www.globenewswire.com/news-release/2023/05/04/2662074/0/en/Vir-Biotechnology-Provides-Corporate-Update-and-Reports-First-Quarter-2023-Financial-Results.html,,Earnings Releases and Operating Results,biotech,2023-05-04 18:05:00.000 +0300,market_open,15,25.260000228881836,25.5,406.92999267578125,405.1300048828125,0.009501178501326877,-0.004423335279694849,0.013924513781021726
IMCR,Immunocore to present at upcoming investor conferences,Immunocore to present at upcoming investor conferences,2023-02-28 14:00:00.000 +0200,Immunocore to present at upcoming investor conferences,https://www.globenewswire.com/news-release/2023/02/28/2616858/0/en/Immunocore-to-present-at-upcoming-investor-conferences.html,,Press releases,biotech,2023-02-28 09:00:00.000 +0200,pre_market,7,54.209999084472656,54.88999938964844,397.7300109863281,397.2300109863281,0.012543816946319657,-0.0012571342020685167,0.013800951148388174
SCPH,scPharmaceuticals Inc. Reports Fourth Quarter and Full-Year 2022 Financial Results and Provides Business Update,"Announced launch and commercial availability of FUROSCIX® (furosemide injection), the first and only self-administered, subcutaneous loop diuretic for the at-home treatment of congestion in chronic heart failure",2023-03-22 22:05:00.000 +0200,"Announced launch and commercial availability of FUROSCIX® (furosemide injection), the first and only self-administered, subcutaneous loop diuretic for the at-home treatment of congestion in chronic heart failure",https://www.globenewswire.com/news-release/2023/03/22/2632699/0/en/scPharmaceuticals-Inc-Reports-Fourth-Quarter-and-Full-Year-2022-Financial-Results-and-Provides-Business-Update.html,,Conference Calls/ Webcasts,biotech,2023-03-22 17:05:00.000 +0200,market_open,15,6.940000057220459,6.920000076293945,398.7300109863281,392.1099853515625,-0.0028818416083016387,-0.01660277744930671,0.013720935841005071
ORIC,ORIC Pharmaceuticals to Participate in Upcoming Investor Conferences,"SOUTH SAN FRANCISCO and SAN DIEGO, Aug.  30, 2023  (GLOBE NEWSWIRE) -- ORIC Pharmaceuticals, Inc. (Nasdaq: ORIC), a clinical stage oncology company focused on developing treatments that address mechanisms of therapeutic resistance, today announced that management will participate in the following investor conferences in the first half of September:",2023-08-30 23:30:00.000 +0300,"SOUTH SAN FRANCISCO and SAN DIEGO, Aug.  30, 2023  (GLOBE NEWSWIRE) -- ORIC Pharmaceuticals, Inc. (Nasdaq: ORIC), a clinical stage oncology company focused on developing treatments that address mechanisms of therapeutic resistance, today announced that management will participate in the following investor conferences in the first half of September:",https://www.globenewswire.com/news-release/2023/08/30/2734804/0/en/ORIC-Pharmaceuticals-to-Participate-in-Upcoming-Investor-Conferences.html,,Conference Calls/ Webcasts,biotech,2023-08-30 18:30:00.000 +0300,market_open,15,9.0,9.149999618530273,449.510009765625,451.010009765625,0.016666624281141493,0.0033369668470388495,0.013329657434102644
DYAI,Dyadic to Present at World Vaccine Congress Washington 2023,"JUPITER, Fla., March  30, 2023  (GLOBE NEWSWIRE) -- Dyadic International, Inc. (“Dyadic”, or the “Company”) (NASDAQ: DYAI), a global biotechnology company focused on building innovative microbial platforms to address the growing demand for global protein bioproduction and unmet clinical needs for effective, affordable and accessible biopharmaceutical products for human and animal health, today announced that its Chief Executive Officer, Mark Emalfarb will be presenting at the upcoming World Vaccine Congress in Washington, D.C.",2023-03-30 15:30:00.000 +0300,"JUPITER, Fla., March  30, 2023  (GLOBE NEWSWIRE) -- Dyadic International, Inc. (“Dyadic”, or the “Company”) (NASDAQ: DYAI), a global biotechnology company focused on building innovative microbial platforms to address the growing demand for global protein bioproduction and unmet clinical needs for effective, affordable and accessible biopharmaceutical products for human and animal health, today announced that its Chief Executive Officer, Mark Emalfarb will be presenting at the upcoming World Vaccine Congress in Washington, D.C.",https://www.globenewswire.com/news-release/2023/03/30/2637625/0/en/Dyadic-to-Present-at-World-Vaccine-Congress-Washington-2023.html,,Calendar of Events,biotech,2023-03-30 10:30:00.000 +0300,pre_market,7,1.4900000095367432,1.5199999809265137,401.3500061035156,404.0899963378906,0.02013420885755418,0.0068269345775674554,0.013307274279986726
