"ticker","title","summary","published","description","link","language","subject","sector","published_est","market","hour_of_day","begin_price","end_price","index_begin_price","index_end_price","return","index_return","alpha"
ELOX,Eloxx Pharmaceuticals Announces FDA Clearance to Begin Single Ascending Dose Study of ZKN-013,ZKN-013 is in development for potential treatment of recessive dystrophic and junctional epidermolysis bullosa (RDEB and JEB) and Familial Adenomatous Polyposis (FAP),2023-05-02 15:00:00.000 +0300,ZKN-013 is in development for potential treatment of recessive dystrophic and junctional epidermolysis bullosa (RDEB and JEB) and Familial Adenomatous Polyposis (FAP),https://www.globenewswire.com/news-release/2023/05/02/2659091/0/en/Eloxx-Pharmaceuticals-Announces-FDA-Clearance-to-Begin-Single-Ascending-Dose-Study-of-ZKN-013.html,,Clinical Study,biotech,2023-05-02 10:00:00.000 +0300,pre_market,7,6.960000038146973,6.869999885559082,415.510009765625,414.7699890136719,-0.012931056335432468,-0.0017809938017390855,-0.011150062533693383
CHRS,Coherus BioSciences Reports Second Quarter 2023 Financial Results and Business Highlights,"– Net revenue rose 81% from prior quarter to $58.7 million –– CIMERLI® net sales quadrupled to $26.7 million compared to prior quarter –– UDENYCA® autoinjector launched in late May, and YUSIMRY™ launched in July –– Planned merger with Surface Oncology expected to significantly advancenext-generation immuno-oncology pipeline –– Conference call today at 5:00 p.m. Eastern Daylight Time –",2023-08-02 23:01:00.000 +0300,"– Net revenue rose 81% from prior quarter to $58.7 million –– CIMERLI® net sales quadrupled to $26.7 million compared to prior quarter –– UDENYCA® autoinjector launched in late May, and YUSIMRY™ launched in July –– Planned merger with Surface Oncology expected to significantly advancenext-generation immuno-oncology pipeline –– Conference call today at 5:00 p.m. Eastern Daylight Time –",https://www.globenewswire.com/news-release/2023/08/02/2717332/33333/en/Coherus-BioSciences-Reports-Second-Quarter-2023-Financial-Results-and-Business-Highlights.html,,Earnings Releases and Operating Results,biotech,2023-08-02 18:01:00.000 +0300,market_open,15,4.420000076293945,4.340000152587891,453.25,450.1300048828125,-0.0180995299378213,-0.006883607539299503,-0.011215922398521795
BIOR,Biora Therapeutics Appoints Dr. Ariella Kelman as Chief Medical Officer,"SAN DIEGO, May  01, 2023  (GLOBE NEWSWIRE) -- Biora Therapeutics, Inc. (Nasdaq: BIOR), the biotech company that is reimagining therapeutic delivery, today announced the appointment of Ariella Kelman, MD, as Chief Medical Officer. Dr. Kelman has a proven track record of leading global biopharmaceutical development, clinical trials, and regulatory strategies.",2023-05-01 16:00:00.000 +0300,"SAN DIEGO, May  01, 2023  (GLOBE NEWSWIRE) -- Biora Therapeutics, Inc. (Nasdaq: BIOR), the biotech company that is reimagining therapeutic delivery, today announced the appointment of Ariella Kelman, MD, as Chief Medical Officer. Dr. Kelman has a proven track record of leading global biopharmaceutical development, clinical trials, and regulatory strategies.",https://www.globenewswire.com/news-release/2023/05/01/2658330/0/en/Biora-Therapeutics-Appoints-Dr-Ariella-Kelman-as-Chief-Medical-Officer.html,,Management Changes,biotech,2023-05-01 11:00:00.000 +0300,pre_market,8,2.430000066757202,2.4000000953674316,415.92999267578125,415.4700012207031,-0.012345666899427295,-0.001105934804361872,-0.011239732095065423
ECOR,"electroCore to Announce Third Quarter Financial Results on Wednesday, November 8","ROCKAWAY, N.J., Oct.  09, 2023  (GLOBE NEWSWIRE) -- electroCore, Inc. (Nasdaq: ECOR), a commercial-stage bioelectronic medicine and wellness company, today announced that it will report financial results for the third quarter ended September 30, 2023, after the close of the market on Wednesday, November 8, 2023. Management will host a conference call and webcast at 4:30 PM EST to discuss the financial results and answer questions.",2023-10-09 15:00:00.000 +0300,"ROCKAWAY, N.J., Oct.  09, 2023  (GLOBE NEWSWIRE) -- electroCore, Inc. (Nasdaq: ECOR), a commercial-stage bioelectronic medicine and wellness company, today announced that it will report financial results for the third quarter ended September 30, 2023, after the close of the market on Wednesday, November 8, 2023. Management will host a conference call and webcast at 4:30 PM EST to discuss the financial results and answer questions.",https://www.globenewswire.com/news-release/2023/10/09/2756628/0/en/electroCore-to-Announce-Third-Quarter-Financial-Results-on-Wednesday-November-8.html,,Conference Calls/ Webcasts,biotech,2023-10-09 10:00:00.000 +0300,pre_market,7,5.590000152587891,5.5,429.5400085449219,427.5799865722656,-0.016100205747977495,-0.004563071969234895,-0.0115371337787426
QGEN,QIAGEN erweitert Angebot an digitalen PCR-Kits und -Dienstleistungen für Biopharma-Branche,"Neue Partnerschaft mit Niba Labs ermöglicht Biopharma-Kunden Zugang zu Dienstleistungen für maßgeschneidertes digitales PCR-Testdesign // Neues CGT Viral Vector Lysis Kit bietet standardisierten Workflow von Zelllysaten bis zur absoluten und präzisen Quantifizierung von Virustitern // Biopharma-Unternehmen setzen vermehrt auf digitale PCR-Technologie, um Sicherheit von Medikamenten und Effizienz im Entwicklungsprozess zu erhöhen",2023-07-18 23:05:00.000 +0300,"Neue Partnerschaft mit Niba Labs ermöglicht Biopharma-Kunden Zugang zu Dienstleistungen für maßgeschneidertes digitales PCR-Testdesign // Neues CGT Viral Vector Lysis Kit bietet standardisierten Workflow von Zelllysaten bis zur absoluten und präzisen Quantifizierung von Virustitern // Biopharma-Unternehmen setzen vermehrt auf digitale PCR-Technologie, um Sicherheit von Medikamenten und Effizienz im Entwicklungsprozess zu erhöhen",https://www.globenewswire.com/news-release/2023/07/18/2706827/0/de/QIAGEN-erweitert-Angebot-an-digitalen-PCR-Kits-und-Dienstleistungen-f%C3%BCr-Biopharma-Branche.html,,Clinical Study,biotech,2023-07-18 18:05:00.000 +0300,market_open,15,45.81999969482422,45.65999984741211,450.5,454.19000244140625,-0.003491921616712337,0.008190904420435628,-0.011682826037147966
QGEN,QIAGEN expands range of digital PCR kits and services for the biopharma industry,New partnership with Niba Labs to offer customized digital PCR (dPCR) assay design services to biopharma customers // Launch of CGT Viral Vector Lysis Kit enabling standardized workflow from cell lysates to absolute and precise quantification of viral titers // Biopharmaceutical companies increasingly adopting dPCR technology for enhanced drug safety and efficacy in drug development process New partnership with Niba Labs to offer customized digital PCR (dPCR) assay design services to biopharma customers // Launch of CGT Viral Vector Lysis Kit enabling standardized workflow from cell lysates to absolute and precise quantification of viral titers // Biopharmaceutical companies increasingly adopting dPCR technology for enhanced drug safety and efficacy in drug development process,2023-07-18 23:05:00.000 +0300,New partnership with Niba Labs to offer customized digital PCR (dPCR) assay design services to biopharma customers // Launch of CGT Viral Vector Lysis Kit enabling standardized workflow from cell lysates to absolute and precise quantification of viral titers // Biopharmaceutical companies increasingly adopting dPCR technology for enhanced drug safety and efficacy in drug development process New partnership with Niba Labs to offer customized digital PCR (dPCR) assay design services to biopharma customers // Launch of CGT Viral Vector Lysis Kit enabling standardized workflow from cell lysates to absolute and precise quantification of viral titers // Biopharmaceutical companies increasingly adopting dPCR technology for enhanced drug safety and efficacy in drug development process,https://www.globenewswire.com/news-release/2023/07/18/2706829/8690/en/QIAGEN-expands-range-of-digital-PCR-kits-and-services-for-the-biopharma-industry.html,,Company Announcement,biotech,2023-07-18 18:05:00.000 +0300,market_open,15,45.81999969482422,45.65999984741211,450.5,454.19000244140625,-0.003491921616712337,0.008190904420435628,-0.011682826037147966
QGEN,QIAGEN delivers ahead of outlook for Q2 2023 with 9% CER sales growth in non-COVID products and updates 2023 full-year outlook,"Q2 2023: Net sales of $495 million (-4% at actual rates, -4% at constant exchange rates, CER); diluted EPS of $0.35 and adjusted diluted EPS of $0.51 // Net sales at CER of $497 million ahead of outlook for at least $490 million CER and adjusted diluted EPS of $0.52 CER ahead of outlook for at least $0.50 CER // 9% CER sales growth in non-COVID product portfolio to $457 million, 10% CER sales growth in recurring consumables and related revenues // Full-year 2023: Outlook revised to net sales of at least $1.97 billion CER due to significant drop in COVID-19 demand and volatility in large-scale customer bulk orders in the OEM  business; adj. diluted EPS revised to at least $2.07 CER Q2 2023: Net sales of $495 million (-4% at actual rates, -4% at constant exchange rates, CER); diluted EPS of $0.35 and adjusted diluted EPS of $0.51 // Net sales at CER of $497 million ahead of outlook for at least $490 million CER and adjusted diluted EPS of $0.52 CER ahead of outlook for at least $0.50 CER // 9% CER sales growth in non-COVID product portfolio to $457 million, 10% CER sales growth in recurring consumables and related revenues // Full-year 2023: Outlook revised to net sales of at least $1.97 billion CER due to significant drop in COVID-19 demand and volatility in large-scale customer bulk orders in the OEM  business; adj. diluted EPS revised to at least $2.07 CER",2023-08-08 23:05:00.000 +0300,"Q2 2023: Net sales of $495 million (-4% at actual rates, -4% at constant exchange rates, CER); diluted EPS of $0.35 and adjusted diluted EPS of $0.51 // Net sales at CER of $497 million ahead of outlook for at least $490 million CER and adjusted diluted EPS of $0.52 CER ahead of outlook for at least $0.50 CER // 9% CER sales growth in non-COVID product portfolio to $457 million, 10% CER sales growth in recurring consumables and related revenues // Full-year 2023: Outlook revised to net sales of at least $1.97 billion CER due to significant drop in COVID-19 demand and volatility in large-scale customer bulk orders in the OEM  business; adj. diluted EPS revised to at least $2.07 CER Q2 2023: Net sales of $495 million (-4% at actual rates, -4% at constant exchange rates, CER); diluted EPS of $0.35 and adjusted diluted EPS of $0.51 // Net sales at CER of $497 million ahead of outlook for at least $490 million CER and adjusted diluted EPS of $0.52 CER ahead of outlook for at least $0.50 CER // 9% CER sales growth in non-COVID product portfolio to $457 million, 10% CER sales growth in recurring consumables and related revenues // Full-year 2023: Outlook revised to net sales of at least $1.97 billion CER due to significant drop in COVID-19 demand and volatility in large-scale customer bulk orders in the OEM  business; adj. diluted EPS revised to at least $2.07 CER",https://www.globenewswire.com/news-release/2023/08/08/2721128/8690/en/QIAGEN-delivers-ahead-of-outlook-for-Q2-2023-with-9-CER-sales-growth-in-non-COVID-products-and-updates-2023-full-year-outlook.html,,Company Announcement,biotech,2023-08-08 18:05:00.000 +0300,market_open,15,45.060001373291016,44.599998474121094,448.0799865722656,448.75,-0.010208674770316034,0.0014952987140975918,-0.011703973484413627
QGEN,QIAGEN übertrifft Prognose für zweites Quartal 2023 mit Umsatzwachstum von 9% (CER) bei Nicht-COVID-Produkten und passt Jahresprognose an,"Q2 2023: Konzernumsatz von $495 Mio. (-4% bei tatsächlichen Kursen; -4% bei konstanten Wechselkursen, CER); verwässerter Gewinn je Aktie von $0,35; bereinigter verwässerter Gewinn je Aktie von $0,51 // Konzernumsatz bei konstanten Wechselkursen (CER) von $497 Mio. gegenüber Prognose von mind. $490 Millionen (CER) und bereinigter verwässerter Gewinn je Aktie von $0,52 (CER) gegenüber Prognose von mind. $0,50 CER // Umsatzwachstum von 9% (CER) beim Nicht-COVID-Produktportfolio auf $457 Mio., Umsatzwachstum von 10% (CER) bei Verbrauchsmaterialien und damit verbundenen Umsätzen // Gesamtjahr 2023: Prognose angepasst auf mindestens $1,97 Mrd. (CER), aufgrund des deutlichen Abfalls der COVID-19-Nachfrage und Volatilität bei Großkundenaufträgen im OEM-Geschäft; Prognose für bereinigten verwässerten Gewinn je Aktie angepasst auf mindestens $2,07 (CER)",2023-08-08 23:05:00.000 +0300,"Q2 2023: Konzernumsatz von $495 Mio. (-4% bei tatsächlichen Kursen; -4% bei konstanten Wechselkursen, CER); verwässerter Gewinn je Aktie von $0,35; bereinigter verwässerter Gewinn je Aktie von $0,51 // Konzernumsatz bei konstanten Wechselkursen (CER) von $497 Mio. gegenüber Prognose von mind. $490 Millionen (CER) und bereinigter verwässerter Gewinn je Aktie von $0,52 (CER) gegenüber Prognose von mind. $0,50 CER // Umsatzwachstum von 9% (CER) beim Nicht-COVID-Produktportfolio auf $457 Mio., Umsatzwachstum von 10% (CER) bei Verbrauchsmaterialien und damit verbundenen Umsätzen // Gesamtjahr 2023: Prognose angepasst auf mindestens $1,97 Mrd. (CER), aufgrund des deutlichen Abfalls der COVID-19-Nachfrage und Volatilität bei Großkundenaufträgen im OEM-Geschäft; Prognose für bereinigten verwässerten Gewinn je Aktie angepasst auf mindestens $2,07 (CER)",https://www.globenewswire.com/news-release/2023/08/08/2721133/0/de/QIAGEN-%C3%BCbertrifft-Prognose-f%C3%BCr-zweites-Quartal-2023-mit-Umsatzwachstum-von-9-CER-bei-Nicht-COVID-Produkten-und-passt-Jahresprognose-an.html,,Earnings Releases and Operating Results,biotech,2023-08-08 18:05:00.000 +0300,market_open,15,45.060001373291016,44.599998474121094,448.0799865722656,448.75,-0.010208674770316034,0.0014952987140975918,-0.011703973484413627
ECOR,TAC-STIM™ Non-Invasive Vagal Nerve Stimulation Selected for Inclusion in the Air Force Research Laboratories Real-Time Assessing and Augmenting Cognitive Performance in Extreme Environments Project,"ROCKAWAY, N.J., June  27, 2023  (GLOBE NEWSWIRE) -- electroCore, Inc. (Nasdaq: ECOR), a commercial-stage bioelectronic medicine and wellness company, today announced that its TAC-STIM non-invasive vagus nerve stimulation (“nVNS”) Human Performance product, has been selected to be a part of the Air Force Research Laboratories (AFRL) Real-Time Assessing and Augmenting Cognitive Performance in Extreme Environments (A2PEX) Grant Program. A2PEX is a five-year project led by the Florida Institute for Human and Machine Cognition (IHMC) that includes internationally-recognized leaders in wearable technologies from industry and academia.",2023-06-27 15:00:00.000 +0300,"ROCKAWAY, N.J., June  27, 2023  (GLOBE NEWSWIRE) -- electroCore, Inc. (Nasdaq: ECOR), a commercial-stage bioelectronic medicine and wellness company, today announced that its TAC-STIM non-invasive vagus nerve stimulation (“nVNS”) Human Performance product, has been selected to be a part of the Air Force Research Laboratories (AFRL) Real-Time Assessing and Augmenting Cognitive Performance in Extreme Environments (A2PEX) Grant Program. A2PEX is a five-year project led by the Florida Institute for Human and Machine Cognition (IHMC) that includes internationally-recognized leaders in wearable technologies from industry and academia.",https://www.globenewswire.com/news-release/2023/06/27/2695227/0/en/TAC-STIM-Non-Invasive-Vagal-Nerve-Stimulation-Selected-for-Inclusion-in-the-Air-Force-Research-Laboratories-Real-Time-Assessing-and-Augmenting-Cognitive-Performance-in-Extreme-Envi.html,,Product / Services Announcement,biotech,2023-06-27 10:00:00.000 +0300,pre_market,7,3.869999885559082,3.8289999961853027,431.44000244140625,432.3500061035156,-0.010594286973178093,0.002109224126089148,-0.012703511099267241
DYAI,Dyadic to Participate at Two Industry Events in May,"JUPITER, Fla., May  10, 2023  (GLOBE NEWSWIRE) -- Dyadic International, Inc. (“Dyadic”, or the “Company”) (NASDAQ: DYAI), a global biotechnology company focused on building innovative microbial platforms to address the growing demand for global protein bioproduction and unmet clinical needs for effective, affordable and accessible biopharmaceutical products for human and animal health, today announced that they will be participating in the following events during the month of May.",2023-05-10 15:30:00.000 +0300,"JUPITER, Fla., May  10, 2023  (GLOBE NEWSWIRE) -- Dyadic International, Inc. (“Dyadic”, or the “Company”) (NASDAQ: DYAI), a global biotechnology company focused on building innovative microbial platforms to address the growing demand for global protein bioproduction and unmet clinical needs for effective, affordable and accessible biopharmaceutical products for human and animal health, today announced that they will be participating in the following events during the month of May.",https://www.globenewswire.com/news-release/2023/05/10/2665543/0/en/Dyadic-to-Participate-at-Two-Industry-Events-in-May.html,,Product / Services Announcement,biotech,2023-05-10 10:30:00.000 +0300,pre_market,7,1.7999999523162842,1.7899999618530273,410.92999267578125,413.8800048828125,-0.005555550404536735,0.007178868078774609,-0.012734418483311343
SPRY,ARS Pharmaceuticals Announces Availability of Briefing Documents for FDA Advisory Committee Meeting on neffy® for the Treatment of Type I Allergic Reactions Including Anaphylaxis,"SAN DIEGO, May  09, 2023  (GLOBE NEWSWIRE) -- ARS Pharmaceuticals, Inc. (NASDAQ: SPRY), a biopharmaceutical company dedicated to empowering at-risk patients and caregivers to better protect themselves from severe allergic reactions that could lead to anaphylaxis, today announced that the U.S. Food and Drug Administration (FDA) posted briefing documents for the Pulmonology, Allergy-Drugs Advisory Committee (PADAC) meeting to review the new drug application (NDA) for neffy®. neffy has the potential to be the first, non-injectable epinephrine nasal spray medicine for the treatment of patients with allergic reactions (type 1), including anaphylaxis.",2023-05-09 16:10:00.000 +0300,"SAN DIEGO, May  09, 2023  (GLOBE NEWSWIRE) -- ARS Pharmaceuticals, Inc. (NASDAQ: SPRY), a biopharmaceutical company dedicated to empowering at-risk patients and caregivers to better protect themselves from severe allergic reactions that could lead to anaphylaxis, today announced that the U.S. Food and Drug Administration (FDA) posted briefing documents for the Pulmonology, Allergy-Drugs Advisory Committee (PADAC) meeting to review the new drug application (NDA) for neffy®. neffy has the potential to be the first, non-injectable epinephrine nasal spray medicine for the treatment of patients with allergic reactions (type 1), including anaphylaxis.",https://www.globenewswire.com/news-release/2023/05/09/2664565/0/en/ARS-Pharmaceuticals-Announces-Availability-of-Briefing-Documents-for-FDA-Advisory-Committee-Meeting-on-neffy-for-the-Treatment-of-Type-I-Allergic-Reactions-Including-Anaphylaxis.html,,Product / Services Announcement,biotech,2023-05-09 11:10:00.000 +0300,pre_market,8,6.010000228881836,5.909999847412109,412.739990234375,411.1300048828125,-0.016638997946982058,-0.0039007253710702165,-0.012738272575911841
IMNN,IMUNON Reports Second Quarter 2023 Financial Results and Provides Business Update,Advances Non-Viral DNA-Mediated Immunotherapy and Next-Generation Vaccine Programs with Multiple Near-Term Milestones Supported by a Strong Balance Sheet,2023-08-10 15:00:00.000 +0300,Advances Non-Viral DNA-Mediated Immunotherapy and Next-Generation Vaccine Programs with Multiple Near-Term Milestones Supported by a Strong Balance Sheet,https://www.globenewswire.com/news-release/2023/08/10/2722608/0/en/IMUNON-Reports-Second-Quarter-2023-Financial-Results-and-Provides-Business-Update.html,,Press releases,biotech,2023-08-10 10:00:00.000 +0300,pre_market,7,1.25,1.2400000095367432,445.75,448.19000244140625,-0.007999992370605469,0.005473925836020752,-0.013473918206626221
ICCC,"ImmuCell Announces Preliminary, Unaudited Sales Results for Q3 2023","PORTLAND, Maine, Oct.  05, 2023  (GLOBE NEWSWIRE) -- ImmuCell Corporation (Nasdaq: ICCC) (“ImmuCell” or the “Company”), a growing animal health company that develops, manufactures and markets scientifically proven and practical products that improve the health and productivity of dairy and beef cattle, today announced preliminary, unaudited sales results for the third quarter of 2023, which ended September 30, 2023.",2023-10-05 23:05:00.000 +0300,"PORTLAND, Maine, Oct.  05, 2023  (GLOBE NEWSWIRE) -- ImmuCell Corporation (Nasdaq: ICCC) (“ImmuCell” or the “Company”), a growing animal health company that develops, manufactures and markets scientifically proven and practical products that improve the health and productivity of dairy and beef cattle, today announced preliminary, unaudited sales results for the third quarter of 2023, which ended September 30, 2023.",https://www.globenewswire.com/news-release/2023/10/05/2755774/0/en/ImmuCell-Announces-Preliminary-Unaudited-Sales-Results-for-Q3-2023.html,,Conference Calls/ Webcasts,biotech,2023-10-05 18:05:00.000 +0300,market_open,15,5.309999942779541,5.239999771118164,424.3599853515625,424.5,-0.013182706669622877,0.0003299430984792,-0.013512649768102118
FBIO,"Aevitas Therapeutics, a Fortress Biotech Subsidiary, Announces Asset Purchase Agreement with 4D Molecular Therapeutics for World-Wide Rights to Aevitas’ Short-Form Human Complement Factor H","Company is eligible to receive up to ~$140 million in potential late-stage development, regulatory and sales milestone payments plus royalties from 4DMT Company is eligible to receive up to ~$140 million in potential late-stage development, regulatory and sales milestone payments plus royalties from 4DMT",2023-04-24 15:00:00.000 +0300,"Company is eligible to receive up to ~$140 million in potential late-stage development, regulatory and sales milestone payments plus royalties from 4DMT Company is eligible to receive up to ~$140 million in potential late-stage development, regulatory and sales milestone payments plus royalties from 4DMT",https://www.globenewswire.com/news-release/2023/04/24/2652668/28889/en/Aevitas-Therapeutics-a-Fortress-Biotech-Subsidiary-Announces-Asset-Purchase-Agreement-with-4D-Molecular-Therapeutics-for-World-Wide-Rights-to-Aevitas-Short-Form-Human-Complement-Fa.html,,Health,biotech,2023-04-24 10:00:00.000 +0300,pre_market,7,10.649999618530273,10.5,412.20001220703125,411.989990234375,-0.014084471727988077,-0.0005095147172164,-0.013574957010771707
DYAI,Dyadic to Participate at Upcoming Events in June,"JUPITER, Fla., June  01, 2023  (GLOBE NEWSWIRE) -- Dyadic International, Inc. (“Dyadic”, or the “Company”) (NASDAQ: DYAI), a global biotechnology company focused on building innovative microbial platforms to address the growing demand for global protein bioproduction and unmet clinical needs for effective, affordable and accessible biopharmaceutical products for human and animal health, and alternative proteins for food, nutrition and wellness, today announced that its management will be participating in the following events during the month of June.",2023-06-01 15:30:00.000 +0300,"JUPITER, Fla., June  01, 2023  (GLOBE NEWSWIRE) -- Dyadic International, Inc. (“Dyadic”, or the “Company”) (NASDAQ: DYAI), a global biotechnology company focused on building innovative microbial platforms to address the growing demand for global protein bioproduction and unmet clinical needs for effective, affordable and accessible biopharmaceutical products for human and animal health, and alternative proteins for food, nutrition and wellness, today announced that its management will be participating in the following events during the month of June.",https://www.globenewswire.com/news-release/2023/06/01/2680321/0/en/Dyadic-to-Participate-at-Upcoming-Events-in-June.html,,Calendar of Events,biotech,2023-06-01 10:30:00.000 +0300,pre_market,7,2.2799999713897705,2.25,417.8500061035156,418.0899963378906,-0.0131578823536055,0.0005743454131135,-0.013732227766718995
FBIO,"Fortress Biotech to Participate in Cantor Medical & Aesthetic Dermatology, Ophthalmology & MedTech/Diagnostic Conference","MIAMI, Dec.  06, 2022  (GLOBE NEWSWIRE) -- Fortress Biotech, Inc. (Nasdaq: FBIO) (“Fortress” or “Company”), an innovative biopharmaceutical company focused on efficiently acquiring, developing and commercializing or monetizing promising therapeutic products and product candidates, today announced that Fortress will participate in one-on-one meetings at the Cantor Medical & Aesthetic Dermatology, Ophthalmology & MedTech/Diagnostic Conference, which is being held on Thursday, December 8, 2022 in Miami, FL.",2022-12-06 15:30:00.000 +0200,"MIAMI, Dec.  06, 2022  (GLOBE NEWSWIRE) -- Fortress Biotech, Inc. (Nasdaq: FBIO) (“Fortress” or “Company”), an innovative biopharmaceutical company focused on efficiently acquiring, developing and commercializing or monetizing promising therapeutic products and product candidates, today announced that Fortress will participate in one-on-one meetings at the Cantor Medical & Aesthetic Dermatology, Ophthalmology & MedTech/Diagnostic Conference, which is being held on Thursday, December 8, 2022 in Miami, FL.",https://www.globenewswire.com/news-release/2022/12/06/2568308/28889/en/Fortress-Biotech-to-Participate-in-Cantor-Medical-Aesthetic-Dermatology-Ophthalmology-MedTech-Diagnostic-Conference.html,,Trade Show,biotech,2022-12-06 10:30:00.000 +0200,pre_market,8,10.5,10.350000381469727,399.5899963378906,399.4200134277344,-0.014285677955264137,-0.0004253933074253,-0.01386028464783881
