"ticker","title","summary","published","description","link","language","subject","sector","published_est","market","hour_of_day","begin_price","end_price","index_begin_price","index_end_price","return","index_return","alpha"
ELOX,Eloxx Pharmaceuticals Reports First Quarter 2023 Financial and Operating Results and Provides Business Update,Topline results to include biopsy results for the Phase 2 clinical study evaluating ELX-02 for the potential treatment of Alport syndrome expected in first half of 2023; meaningful protein reduction has been observed in one patient to date,2023-05-15 23:30:00.000 +0300,Topline results to include biopsy results for the Phase 2 clinical study evaluating ELX-02 for the potential treatment of Alport syndrome expected in first half of 2023; meaningful protein reduction has been observed in one patient to date,https://www.globenewswire.com/news-release/2023/05/15/2669369/0/en/Eloxx-Pharmaceuticals-Reports-First-Quarter-2023-Financial-and-Operating-Results-and-Provides-Business-Update.html,,Earnings Releases and Operating Results,biotech,2023-05-15 18:30:00.000 +0300,market_open,15,3.5399999618530273,10.899999618530273,412.2200012207031,413.010009765625,2.07909597061821,0.0019164731031546998,2.077179497515055
TTOO,T2 Biosystems Receives FDA Breakthrough Device Designation for Candida Auris Diagnostic Test,"LEXINGTON, Mass., July  20, 2023  (GLOBE NEWSWIRE) -- T2 Biosystems, Inc. (NASDAQ:TTOO), a leader in the rapid detection of sepsis-causing pathogens and antibiotic resistance genes, announced today the U.S. Food and Drug Administration (FDA) has granted Breakthrough Device designation for the Company’s Candida auris (C. auris) direct-from-blood molecular diagnostic test.",2023-07-20 15:30:00.000 +0300,"LEXINGTON, Mass., July  20, 2023  (GLOBE NEWSWIRE) -- T2 Biosystems, Inc. (NASDAQ:TTOO), a leader in the rapid detection of sepsis-causing pathogens and antibiotic resistance genes, announced today the U.S. Food and Drug Administration (FDA) has granted Breakthrough Device designation for the Company’s Candida auris (C. auris) direct-from-blood molecular diagnostic test.",https://www.globenewswire.com/news-release/2023/07/20/2708188/32489/en/T2-Biosystems-Receives-FDA-Breakthrough-Device-Designation-for-Candida-Auris-Diagnostic-Test.html,,Product / Services Announcement,biotech,2023-07-20 10:30:00.000 +0300,pre_market,7,0.10199999809265137,0.14000000059604645,455.20001220703125,454.1700134277344,0.3725490511174118,-0.002262738909656306,0.3748117900270681
TTOO,T2 Biosystems Announces Submission for FDA Breakthrough Device Designation for Candida Auris Diagnostic Test,Company plans to add multidrug-resistant Candida auris detection to its FDA-cleared T2Candida Panel Company plans to add multidrug-resistant Candida auris detection to its FDA-cleared T2Candida Panel,2023-06-05 16:00:00.000 +0300,Company plans to add multidrug-resistant Candida auris detection to its FDA-cleared T2Candida Panel Company plans to add multidrug-resistant Candida auris detection to its FDA-cleared T2Candida Panel,https://www.globenewswire.com/news-release/2023/06/05/2682027/32489/en/T2-Biosystems-Announces-Submission-for-FDA-Breakthrough-Device-Designation-for-Candida-Auris-Diagnostic-Test.html,,Company Announcement,biotech,2023-06-05 11:00:00.000 +0300,pre_market,8,0.10199999809265137,0.13899999856948853,427.9200134277344,428.2799987792969,0.36274510949724065,0.0008412444855732,0.36190386501166744
TALS,Talaris Therapeutics to Present at the H.C. Wainwright Global Investment Conference,"BOSTON and LOUISVILLE, Ky., May  17, 2022  (GLOBE NEWSWIRE) -- Talaris Therapeutics, Inc. (Nasdaq: TALS), a late-clinical stage cell therapy company developing therapies with the potential to transform the standard of care in solid organ transplantation and severe immune and blood disorders, today announced today announced that Scott Requadt, Chief Executive Officer of Talaris, will be presenting virtually at the H.C. Wainwright Global Investment Conference being held May 23-25, 2022.",2022-05-17 23:01:00.000 +0300,"BOSTON and LOUISVILLE, Ky., May  17, 2022  (GLOBE NEWSWIRE) -- Talaris Therapeutics, Inc. (Nasdaq: TALS), a late-clinical stage cell therapy company developing therapies with the potential to transform the standard of care in solid organ transplantation and severe immune and blood disorders, today announced today announced that Scott Requadt, Chief Executive Officer of Talaris, will be presenting virtually at the H.C. Wainwright Global Investment Conference being held May 23-25, 2022.",https://www.globenewswire.com/news-release/2022/05/17/2445422/0/en/Talaris-Therapeutics-to-Present-at-the-H-C-Wainwright-Global-Investment-Conference.html,,Calendar of Events,biotech,2022-05-17 18:01:00.000 +0300,market_open,15,6.809999942779541,8.890000343322754,406.5299987792969,408.32000732421875,0.30543324787375087,0.004403140113390898,0.30103010776036
ELOX,Eloxx Pharmaceuticals Announces Final Data Assessment from Phase 2 Combination Clinical Trial of ELX-02 in Class 1 Cystic Fibrosis (CF) Patients, ,2023-06-14 23:53:00.000 +0300, ,https://www.globenewswire.com/news-release/2023/06/14/2688488/0/en/Eloxx-Pharmaceuticals-Announces-Final-Data-Assessment-from-Phase-2-Combination-Clinical-Trial-of-ELX-02-in-Class-1-Cystic-Fibrosis-CF-Patients.html,,Clinical Study,biotech,2023-06-14 18:53:00.000 +0300,market_open,15,5.599999904632568,6.980000019073486,437.010009765625,437.17999267578125,0.24642859606110362,0.0003889680015508,0.2460396280595528
PYPD,PolyPid Announces Reverse Share Split,"PETACH TIKVA, Israel, Sept.  20, 2023  (GLOBE NEWSWIRE) -- PolyPid Ltd. (Nasdaq: PYPD) (“PolyPid” or the “Company”), a late-stage biopharma company aiming to improve surgical outcomes, today announces a reverse share split (the “Reverse Split”) of the Company’s issued and outstanding ordinary shares, no par value (“Ordinary Shares”), at the ratio of 1-for-30, such that each thirty (30) Ordinary Shares, shall be consolidated into one (1) Ordinary Share.",2023-09-20 16:15:00.000 +0300,"PETACH TIKVA, Israel, Sept.  20, 2023  (GLOBE NEWSWIRE) -- PolyPid Ltd. (Nasdaq: PYPD) (“PolyPid” or the “Company”), a late-stage biopharma company aiming to improve surgical outcomes, today announces a reverse share split (the “Reverse Split”) of the Company’s issued and outstanding ordinary shares, no par value (“Ordinary Shares”), at the ratio of 1-for-30, such that each thirty (30) Ordinary Shares, shall be consolidated into one (1) Ordinary Share.",https://www.globenewswire.com/news-release/2023/09/20/2746559/0/en/PolyPid-Announces-Reverse-Share-Split.html,,Stock Market News,biotech,2023-09-20 11:15:00.000 +0300,pre_market,8,6.03000020980835,7.5,442.7099914550781,444.010009765625,0.24378105125113606,0.002936500950145798,0.24084455030099025
ORPHA.CO,Change in management,"The board of directors and CEO/CFO Anders Fink Vadsholt has today entered into a severance agreement pursuant to which Mr. Vadsholt will step down as CEO/CFO of the Company. Regardless, Mr. Vadsholt will remain available for the company until his replacement has been found and all disputes related to the US security class action case has been finally settled, however, in no event longer than until 1 October 2023.",2023-05-30 20:41:00.000 +0300,"The board of directors and CEO/CFO Anders Fink Vadsholt has today entered into a severance agreement pursuant to which Mr. Vadsholt will step down as CEO/CFO of the Company. Regardless, Mr. Vadsholt will remain available for the company until his replacement has been found and all disputes related to the US security class action case has been finally settled, however, in no event longer than until 1 October 2023.",https://www.globenewswire.com/news-release/2023/05/30/2678759/0/en/Change-in-management.html,,European Regulatory News,biotech,2023-05-30 15:41:00.000 +0300,market_open,12,2.259999990463257,2.700000047683716,422.0299987792969,420.17999267578125,0.1946902916270665,-0.004383589102354538,0.19907388072942103
TTOO,T2 Biosystems to Participate in the Gilmartin Group Emerging Growth Company Showcase,"LEXINGTON, Mass., Sept.  07, 2023  (GLOBE NEWSWIRE) -- T2 Biosystems, Inc. (NASDAQ:TTOO), a leader in the rapid detection of sepsis-causing pathogens and antibiotic resistance genes, today announced plans to participate in the upcoming Gilmartin Group Emerging Growth Company Showcase, taking place virtually. Members of management are scheduled to host a fireside chat on Thursday, September 21, 2023, at 10:30am ET.",2023-09-07 23:05:00.000 +0300,"LEXINGTON, Mass., Sept.  07, 2023  (GLOBE NEWSWIRE) -- T2 Biosystems, Inc. (NASDAQ:TTOO), a leader in the rapid detection of sepsis-causing pathogens and antibiotic resistance genes, today announced plans to participate in the upcoming Gilmartin Group Emerging Growth Company Showcase, taking place virtually. Members of management are scheduled to host a fireside chat on Thursday, September 21, 2023, at 10:30am ET.",https://www.globenewswire.com/news-release/2023/09/07/2739767/32489/en/T2-Biosystems-to-Participate-in-the-Gilmartin-Group-Emerging-Growth-Company-Showcase.html,,Conference Calls/ Webcasts,biotech,2023-09-07 18:05:00.000 +0300,market_open,15,0.29100000858306885,0.34299999475479126,443.1099853515625,444.8500061035156,0.17869410528514984,0.0039268371498615545,0.17476726813528828
DYAI,"Dyadic to Report First Quarter 2023 Financial Results on Wednesday, May 10, 2023","JUPITER, Fla., April  26, 2023  (GLOBE NEWSWIRE) -- Dyadic International, Inc. (“Dyadic”, “we”, “us”, “our”, or the “Company”) (NASDAQ: DYAI), a global biotechnology company focused on building innovative microbial platforms to address the growing demand for global protein bioproduction and unmet clinical needs for effective, affordable and accessible biopharmaceutical products for human and animal health, today announced that it will report its financial results for first quarter 2023 and host a corporate update conference call on Wednesday, May 10, 2023.",2023-04-26 23:30:00.000 +0300,"JUPITER, Fla., April  26, 2023  (GLOBE NEWSWIRE) -- Dyadic International, Inc. (“Dyadic”, “we”, “us”, “our”, or the “Company”) (NASDAQ: DYAI), a global biotechnology company focused on building innovative microbial platforms to address the growing demand for global protein bioproduction and unmet clinical needs for effective, affordable and accessible biopharmaceutical products for human and animal health, today announced that it will report its financial results for first quarter 2023 and host a corporate update conference call on Wednesday, May 10, 2023.",https://www.globenewswire.com/news-release/2023/04/26/2655687/0/en/Dyadic-to-Report-First-Quarter-2023-Financial-Results-on-Wednesday-May-10-2023.html,,Calendar of Events,biotech,2023-04-26 18:30:00.000 +0300,market_open,15,1.809999942779541,2.0999999046325684,406.7200012207031,404.3599853515625,0.16022097846461064,-0.005802556702540878,0.16602353516715151
TTOO,T2 Biosystems Reports Granting of Inducement Award,"LEXINGTON, Mass., Oct.  06, 2023  (GLOBE NEWSWIRE) -- T2 Biosystems, Inc. (NASDAQ:TTOO) a leader in the rapid detection of sepsis-causing pathogens, announced today that it issued inducement awards to nine new employees.",2023-10-06 23:07:00.000 +0300,"LEXINGTON, Mass., Oct.  06, 2023  (GLOBE NEWSWIRE) -- T2 Biosystems, Inc. (NASDAQ:TTOO) a leader in the rapid detection of sepsis-causing pathogens, announced today that it issued inducement awards to nine new employees.",https://www.globenewswire.com/news-release/2023/10/06/2756309/32489/en/T2-Biosystems-Reports-Granting-of-Inducement-Award.html,,Contests/Awards,biotech,2023-10-06 18:07:00.000 +0300,market_open,15,0.2240000069141388,0.2630000114440918,421.9700012207031,429.5400085449219,0.1741071577060355,0.017939681262458766,0.15616747644357673
KA,Kineta Announces New Research Agreement to Evaluate VISTA Biomarker Expression,"SEATTLE, Sept.  18, 2023  (GLOBE NEWSWIRE) -- Kineta, Inc. (Nasdaq: KA), a clinical-stage biotechnology company focused on the development of novel immunotherapies in oncology that address cancer immune resistance, announced today a research agreement with Fred Hutchinson Cancer Center to evaluate VISTA expression as a potential biomarker in cancer patients from Kineta’s ongoing Phase 1/2 clinical trial evaluating KVA12123, the company’s VISTA blocking immunotherapy, alone and in combination with pembrolizumab.",2023-09-18 16:30:00.000 +0300,"SEATTLE, Sept.  18, 2023  (GLOBE NEWSWIRE) -- Kineta, Inc. (Nasdaq: KA), a clinical-stage biotechnology company focused on the development of novel immunotherapies in oncology that address cancer immune resistance, announced today a research agreement with Fred Hutchinson Cancer Center to evaluate VISTA expression as a potential biomarker in cancer patients from Kineta’s ongoing Phase 1/2 clinical trial evaluating KVA12123, the company’s VISTA blocking immunotherapy, alone and in combination with pembrolizumab.",https://www.globenewswire.com/news-release/2023/09/18/2744896/0/en/Kineta-Announces-New-Research-Agreement-to-Evaluate-VISTA-Biomarker-Expression.html,,Health,biotech,2023-09-18 11:30:00.000 +0300,pre_market,8,1.9299999475479126,2.2200000286102295,443.3699951171875,443.04998779296875,0.15025911344234252,-0.0007217613454744,0.1509808747878169
EVAX,Evaxion Partners With Pharmaceutical Company Afrigen Biologics to Develop Novel mRNA Vaccine Against Gonorrhea,"COPENHAGEN, Denmark, Sept.  20, 2023  (GLOBE NEWSWIRE) -- Evaxion Biotech A/S (NASDAQ: EVAX) (“Evaxion” or the “Company”), a clinical-stage biotechnology company specializing in the development of AI-powered immunotherapies, today announced a collaboration with Afrigen Biologics (Afrigen). The collaboration aims at developing a prophylactic vaccine based on Evaxion’s EDEN™-discovered gonorrhea targets.",2023-09-20 15:26:00.000 +0300,"COPENHAGEN, Denmark, Sept.  20, 2023  (GLOBE NEWSWIRE) -- Evaxion Biotech A/S (NASDAQ: EVAX) (“Evaxion” or the “Company”), a clinical-stage biotechnology company specializing in the development of AI-powered immunotherapies, today announced a collaboration with Afrigen Biologics (Afrigen). The collaboration aims at developing a prophylactic vaccine based on Evaxion’s EDEN™-discovered gonorrhea targets.",https://www.globenewswire.com/news-release/2023/09/20/2746452/0/en/Evaxion-Partners-With-Pharmaceutical-Company-Afrigen-Biologics-to-Develop-Novel-mRNA-Vaccine-Against-Gonorrhea.html,,Partnerships,biotech,2023-09-20 10:26:00.000 +0300,pre_market,7,0.47999998927116394,0.5529999732971191,442.7099914550781,444.010009765625,0.15208330345340007,0.002936500950145798,0.14914680250325427
EVAX,Evaxion geht Partnerschaft mit dem Pharmaunternehmen Afrigen Biologics zur Entwicklung eines neuartigen mRNA-Impfstoffs gegen Gonorrhoe ein,"KOPENHAGEN, Dänemark, Oct.  05, 2023  (GLOBE NEWSWIRE) -- Evaxion Biotech A/S (NASDAQ: EVAX) („Evaxion“ oder das „Unternehmen“), ein im klinischen Stadium tätiges Biotechnologieunternehmen, das sich auf die Entwicklung von KI-gestützten Immuntherapien spezialisiert hat, hat heute eine Zusammenarbeit mit Afrigen Biologics (Afrigen) bekanntgegeben. Ziel der Zusammenarbeit ist die Entwicklung eines prophylaktischen Impfstoffs, der auf den mittels der EDEN™-Plattform von Evaxion entdeckten Gonorrhoe-Ziele basiert.",2023-09-20 15:26:00.000 +0300,"KOPENHAGEN, Dänemark, Oct.  05, 2023  (GLOBE NEWSWIRE) -- Evaxion Biotech A/S (NASDAQ: EVAX) („Evaxion“ oder das „Unternehmen“), ein im klinischen Stadium tätiges Biotechnologieunternehmen, das sich auf die Entwicklung von KI-gestützten Immuntherapien spezialisiert hat, hat heute eine Zusammenarbeit mit Afrigen Biologics (Afrigen) bekanntgegeben. Ziel der Zusammenarbeit ist die Entwicklung eines prophylaktischen Impfstoffs, der auf den mittels der EDEN™-Plattform von Evaxion entdeckten Gonorrhoe-Ziele basiert.",https://www.globenewswire.com/news-release/2023/09/20/2755536/0/de/Evaxion-geht-Partnerschaft-mit-dem-Pharmaunternehmen-Afrigen-Biologics-zur-Entwicklung-eines-neuartigen-mRNA-Impfstoffs-gegen-Gonorrhoe-ein.html,,Partnerships,biotech,2023-09-20 10:26:00.000 +0300,pre_market,7,0.47999998927116394,0.5529999732971191,442.7099914550781,444.010009765625,0.15208330345340007,0.002936500950145798,0.14914680250325427
EVAX,Evaxion s'associe à la société pharmaceutique Afrigen Biologics pour développer un nouveau vaccin à ARN messager contre la gonorrhée,"COPENHAGUE, Danemark,  05 oct. 2023  (GLOBE NEWSWIRE) -- Evaxion Biotech A/S (NASDAQ : EVAX), ci-après « Evaxion » ou la « Société », une société de biotechnologie axée sur la recherche clinique et spécialisée dans le développement d'immunothérapies reposant sur l'IA, a annoncé ce jour une collaboration avec Afrigen Biologics, ci-après « Afrigen ». Cette collaboration vise à développer un vaccin prophylactique basé sur les cibles de la gonorrhée découvertes par la plateforme EDEN™ d'Evaxion.",2023-09-20 15:26:00.000 +0300,"COPENHAGUE, Danemark,  05 oct. 2023  (GLOBE NEWSWIRE) -- Evaxion Biotech A/S (NASDAQ : EVAX), ci-après « Evaxion » ou la « Société », une société de biotechnologie axée sur la recherche clinique et spécialisée dans le développement d'immunothérapies reposant sur l'IA, a annoncé ce jour une collaboration avec Afrigen Biologics, ci-après « Afrigen ». Cette collaboration vise à développer un vaccin prophylactique basé sur les cibles de la gonorrhée découvertes par la plateforme EDEN™ d'Evaxion.",https://www.globenewswire.com/news-release/2023/09/20/2755536/0/fr/Evaxion-s-associe-%C3%A0-la-soci%C3%A9t%C3%A9-pharmaceutique-Afrigen-Biologics-pour-d%C3%A9velopper-un-nouveau-vaccin-%C3%A0-ARN-messager-contre-la-gonorrh%C3%A9e.html,,Partnerships,biotech,2023-09-20 10:26:00.000 +0300,pre_market,7,0.47999998927116394,0.5529999732971191,442.7099914550781,444.010009765625,0.15208330345340007,0.002936500950145798,0.14914680250325427
SNCE,Science 37 Reports Inducement Grant Under NASDAQ Listing Rule 5635(c)(4),"RESEARCH TRIANGLE PARK, N.C., June  09, 2023  (GLOBE NEWSWIRE) -- Science 37 Holdings, Inc. (Nasdaq: SNCE), the industry-leading Metasite™, today announced the granting of inducement equity awards under the Science 37 Holdings, Inc. 2022 Employment Inducement Incentive Award Plan (the “Plan”). The Plan was approved by Science 37’s Board of Directors in November 2022. In accordance with NASDAQ Listing Rule 5635(c)(4), the awards were approved by Science 37’s Compensation Committee and made as a material inducement to the non-executive employees' entry into employment with the Company.",2023-06-09 23:51:00.000 +0300,"RESEARCH TRIANGLE PARK, N.C., June  09, 2023  (GLOBE NEWSWIRE) -- Science 37 Holdings, Inc. (Nasdaq: SNCE), the industry-leading Metasite™, today announced the granting of inducement equity awards under the Science 37 Holdings, Inc. 2022 Employment Inducement Incentive Award Plan (the “Plan”). The Plan was approved by Science 37’s Board of Directors in November 2022. In accordance with NASDAQ Listing Rule 5635(c)(4), the awards were approved by Science 37’s Compensation Committee and made as a material inducement to the non-executive employees' entry into employment with the Company.",https://www.globenewswire.com/news-release/2023/06/09/2685814/0/en/Science-37-Reports-Inducement-Grant-Under-NASDAQ-Listing-Rule-5635-c-4.html,,Stock Market News,biotech,2023-06-09 18:51:00.000 +0300,market_open,15,0.25999999046325684,0.2980000078678131,429.9599914550781,429.8999938964844,0.14615391845534098,-0.0001395421894737,0.14629346064481472
ANAB,AnaptysBio- and GSK-Partnered Immuno-Oncology Agent JEMPERLI (dostarlimab-gxly) plus Chemotherapy Approved in the U.S. for dMMR/MSI-H Primary Advanced or Recurrent Endometrial Cancer,"SAN DIEGO, July  31, 2023  (GLOBE NEWSWIRE) -- AnaptysBio, Inc. (Nasdaq: ANAB), a clinical-stage biotechnology company focused on delivering innovative immunology therapeutics, today announced that GSK has received U.S. Food and Drug Administration (FDA) approval for JEMPERLI (dostarlimab-gxly) plus carboplatin and paclitaxel (chemotherapy) for the treatment of adult patients with mismatch repair deficient (dMMR)/microsatellite instability-high (MSI-H) primary advanced or recurrent endometrial cancer. The supplemental Biologics License Application (sBLA) supporting this new indication received Priority Review and was approved ahead of the Sept. 23, 2023 Prescription Drug User Fee Act action date.",2023-07-31 20:34:00.000 +0300,"SAN DIEGO, July  31, 2023  (GLOBE NEWSWIRE) -- AnaptysBio, Inc. (Nasdaq: ANAB), a clinical-stage biotechnology company focused on delivering innovative immunology therapeutics, today announced that GSK has received U.S. Food and Drug Administration (FDA) approval for JEMPERLI (dostarlimab-gxly) plus carboplatin and paclitaxel (chemotherapy) for the treatment of adult patients with mismatch repair deficient (dMMR)/microsatellite instability-high (MSI-H) primary advanced or recurrent endometrial cancer. The supplemental Biologics License Application (sBLA) supporting this new indication received Priority Review and was approved ahead of the Sept. 23, 2023 Prescription Drug User Fee Act action date.",https://www.globenewswire.com/news-release/2023/07/31/2715235/0/en/AnaptysBio-and-GSK-Partnered-Immuno-Oncology-Agent-JEMPERLI-dostarlimab-gxly-plus-Chemotherapy-Approved-in-the-U-S-for-dMMR-MSI-H-Primary-Advanced-or-Recurrent-Endometrial-Cancer.html,,Health,biotech,2023-07-31 15:34:00.000 +0300,market_open,12,17.209999084472656,19.709999084472656,457.4100036621094,457.7900085449219,0.14526438890142476,0.0008307751902453,0.14443361371117944
TTOO,T2 Biosystems Reports Granting of Inducement Award,"LEXINGTON, Mass., Sept.  15, 2023  (GLOBE NEWSWIRE) -- T2 Biosystems, Inc. (NASDAQ:TTOO), a leader in the rapid detection of sepsis-causing pathogens, announced today that it issued inducement awards to four new employees.",2023-09-15 23:05:00.000 +0300,"LEXINGTON, Mass., Sept.  15, 2023  (GLOBE NEWSWIRE) -- T2 Biosystems, Inc. (NASDAQ:TTOO), a leader in the rapid detection of sepsis-causing pathogens, announced today that it issued inducement awards to four new employees.",https://www.globenewswire.com/news-release/2023/09/15/2744244/32489/en/T2-Biosystems-Reports-Granting-of-Inducement-Award.html,,Major shareholder announcements,biotech,2023-09-15 18:05:00.000 +0300,market_open,15,0.2460000067949295,0.2770000100135803,447.1400146484375,443.3699951171875,0.1260162697657689,-0.008431407182857849,0.13444767694862675
SCLX,Scilex Holding Company Provides Notice to All Lenders of Short Positions in the Restricted Dividend Shares of Scilex Holding Company,"PALO ALTO, Calif., Oct.  04, 2023  (GLOBE NEWSWIRE) -- Scilex Holding Company (Nasdaq: SCLX, “Scilex” or “Company”), an innovative revenue-generating company focused on acquiring, developing and commercializing non-opioid pain management products for the treatment of acute and chronic pain, provides notice to all lenders of short positions of restricted shares of Scilex common stock that were part of the previously announced dividend of Scilex common stock then-held by Sorrento Therapeutics, Inc. (OTC: SRNEQ, “Sorrento”) to Sorrento equity holders of record as of January 9, 2023.",2023-10-04 19:59:00.000 +0300,"PALO ALTO, Calif., Oct.  04, 2023  (GLOBE NEWSWIRE) -- Scilex Holding Company (Nasdaq: SCLX, “Scilex” or “Company”), an innovative revenue-generating company focused on acquiring, developing and commercializing non-opioid pain management products for the treatment of acute and chronic pain, provides notice to all lenders of short positions of restricted shares of Scilex common stock that were part of the previously announced dividend of Scilex common stock then-held by Sorrento Therapeutics, Inc. (OTC: SRNEQ, “Sorrento”) to Sorrento equity holders of record as of January 9, 2023.",https://www.globenewswire.com/news-release/2023/10/04/2754860/0/en/Scilex-Holding-Company-Provides-Notice-to-All-Lenders-of-Short-Positions-in-the-Restricted-Dividend-Shares-of-Scilex-Holding-Company.html,,Dividend Reports and Estimates,biotech,2023-10-04 14:59:00.000 +0300,market_open,11,1.2400000095367432,1.409999966621399,422.07000732421875,424.6600036621094,0.13709673852999948,0.006136414085213794,0.1309603244447857
ORIC,ORIC Pharmaceuticals Announces $85 Million Private Placement Financing,"Financing led by Nextech and includes participation from EcoR1 Capital, Frazier Life Sciences, Venrock Healthcare Capital Partners, and Boxer Capital",2023-06-26 15:30:00.000 +0300,"Financing led by Nextech and includes participation from EcoR1 Capital, Frazier Life Sciences, Venrock Healthcare Capital Partners, and Boxer Capital",https://www.globenewswire.com/news-release/2023/06/26/2694439/0/en/ORIC-Pharmaceuticals-Announces-85-Million-Private-Placement-Financing.html,,Changes in company's own shares,biotech,2023-06-26 10:30:00.000 +0300,pre_market,7,6.489999771118164,7.289999961853027,433.2099914550781,432.6199951171875,0.12326659768079329,-0.0013619176600911914,0.12462851534088448
